<?xml version="1.0"?>
<!DOCTYPE COrnLathe PUBLIC "-//IDN billooms.com//DTD COrnLathe file format 3.0//EN" "http://www.billooms.com/dtds/cornlathe3_0.dtd">
<COrnLathe version="3.0">
  <Controls active='NORMAL'>
    <FeedRate rpm='3.00' velocity='4.0'/>
    <CoarseFine passDepth='0.0250' passStep='5' lastDepth='0.0050' lastStep='1' rotation='NEG_LAST'/>
  </Controls>
  <Cutters>
    <Cutter name='HCF' displayName='HCF with R=0.512' 
            radius='0.512' location='FRONT_INSIDE' frame='HCF' ucfAngle='0.0' ucfRotate='0.0' 
            profile='IDEAL' tipWidth='0.1875'/>
  </Cutters>
  <Outline dotLocation='FRONT_INSIDE' thickness='0.100' resolution='0.020'>
    <Pt x='0.000' y='0.000'/>
    <Pt x='1.000' y='0.200'/>
    <Pt x='2.000' y='1.000'/>
  </Outline>
</COrnLathe>
